{
  "schema_version": 1,
  "id": "halloween",
  "version": "v001",
  "layout_profile": "paper-v021",
  "font": {
    "id": "prompt-bold",
    "version": "v001"
  },
  "palette": {
    "ink": "#2E2738",
    "paper": "#FFF8E8",
    "accents": [
      "#F28C28",
      "#654C80",
      "#526D58",
      "#B65165"
    ]
  },
  "text_colors": {
    "paper": "#2E2738",
    "accents": [
      "#2E2738",
      "#FFF8E8",
      "#FFF8E8",
      "#FFF8E8"
    ]
  },
  "background": {
    "mode": "image",
    "colors": [
      "#FFF8E8",
      "#F9F1E3"
    ],
    "asset": {
      "id": "pumpkin-paper",
      "version": "v001"
    },
    "grid": {
      "enabled": true,
      "step_px": 52,
      "color": "#9A879D",
      "opacity": 0.12,
      "width_px": 1
    }
  },
  "background_variants": [
    {
      "id": "pumpkin-paper",
      "asset": {
        "id": "pumpkin-paper",
        "version": "v001"
      },
      "intended_use": "Lists, summaries, and evidence scenes; central reading regions stay smooth."
    },
    {
      "id": "moon-mist",
      "asset": {
        "id": "moon-mist",
        "version": "v001"
      },
      "intended_use": "Opening, title, and low-density transition scenes; central reading regions stay smooth."
    }
  ],
  "cards": {
    "style": "rough-paper",
    "border_px": 4,
    "outline_px": 11,
    "shadow_offset_px": [
      6,
      6
    ],
    "roughness_px": 5,
    "padding_px": 9
  },
  "captions": {
    "preset": "halloween-capsule",
    "font_size_px": 80,
    "height_px": 140,
    "y_px": 1635,
    "gap_px": 18,
    "max_width_px": 960,
    "padding_px": 16,
    "fill_palette_indexes": [
      0,
      1,
      2,
      3
    ],
    "text_palette_keys": [
      "ink",
      "paper",
      "paper",
      "paper"
    ],
    "preset_asset": {
      "id": "halloween-capsule",
      "version": "v001"
    }
  },
  "layout": {
    "brand_center_px": [
      228,
      92
    ],
    "topic_center_px": [
      850,
      92
    ],
    "title_center_px": [
      540,
      255
    ],
    "content_center_px": [
      540,
      555
    ],
    "mascot_center_px": [
      375,
      1210
    ],
    "mascot_right_center_px": [
      710,
      1210
    ],
    "aside_center_px": [
      820,
      1130
    ],
    "aside_right_center_px": [
      265,
      1130
    ],
    "cta_center_px": [
      540,
      1465
    ],
    "footer_box": [
      75,
      1765,
      930,
      64
    ],
    "progress_box": [
      90,
      1850,
      990,
      1860
    ]
  },
  "motion": {
    "seed": 90,
    "mascot_bob_px": 7,
    "mascot_bob_rate": 3.0
  },
  "audio": {
    "bgm_default": "off",
    "sfx_gain": 1.0
  },
  "decorations": [
    {
      "id": "pumpkin-smile",
      "asset": {
        "id": "pumpkin-smile",
        "version": "v001"
      },
      "center_px": [
        980,
        360
      ],
      "size_px": 68,
      "intended_use": "Opening or summary only when the upper-right area is empty.",
      "safe_area_blocks": [
        "mascot_face",
        "mascot_mouth",
        "evidence",
        "logo",
        "numbers",
        "caption_chips",
        "text_safe_area"
      ],
      "collision_policy": "skip",
      "motion": "static"
    },
    {
      "id": "bat-sticker",
      "asset": {
        "id": "bat-sticker",
        "version": "v001"
      },
      "center_px": [
        82,
        1440
      ],
      "size_px": 62,
      "intended_use": "Transition or scene with clear space beside the main image.",
      "safe_area_blocks": [
        "mascot_face",
        "mascot_mouth",
        "evidence",
        "logo",
        "numbers",
        "caption_chips",
        "text_safe_area"
      ],
      "collision_policy": "skip",
      "motion": "static"
    },
    {
      "id": "constellation-sticker",
      "asset": {
        "id": "constellation-sticker",
        "version": "v001"
      },
      "center_px": [
        975,
        1505
      ],
      "size_px": 46,
      "intended_use": "Quiet scene with a verified empty lower-right area.",
      "safe_area_blocks": [
        "mascot_face",
        "mascot_mouth",
        "evidence",
        "logo",
        "numbers",
        "caption_chips",
        "text_safe_area"
      ],
      "collision_policy": "skip",
      "motion": "static"
    }
  ],
  "mascot_concept": {
    "id": "liplnwza-halloween-costume",
    "version": "v001"
  }
}
