{
  "schema_version": 1,
  "id": "base-paper",
  "version": "v001",
  "layout_profile": "paper-v021",
  "font": {
    "id": "prompt-bold",
    "version": "v001"
  },
  "palette": {
    "ink": "#181B26",
    "paper": "#FFFDF6",
    "accents": ["#FFD648", "#2264D8", "#F44336", "#38B577"]
  },
  "text_colors": {
    "paper": "#181B26",
    "accents": ["#181B26", "#FFFDF6", "#FFFDF6", "#FFFDF6"]
  },
  "background": {
    "mode": "grid",
    "colors": ["#F3DFDC", "#D7E9DB", "#DCE6F5", "#F4E9CE"],
    "asset": null,
    "grid": {
      "enabled": true,
      "step_px": 52,
      "color": "#785F5A",
      "opacity": 0.1568627450980392,
      "width_px": 2
    }
  },
  "cards": {
    "style": "rough-paper",
    "border_px": 4,
    "outline_px": 11,
    "shadow_offset_px": [6, 6],
    "roughness_px": 5,
    "padding_px": 9
  },
  "captions": {
    "preset": "base-paper-v001",
    "font_size_px": 80,
    "height_px": 140,
    "y_px": 1635,
    "gap_px": 18,
    "max_width_px": 960,
    "padding_px": 16,
    "fill_palette_indexes": [0, 1, 2, 3],
    "text_palette_keys": ["ink", "paper", "paper", "paper"]
  },
  "layout": {
    "brand_center_px": [228, 92],
    "topic_center_px": [850, 92],
    "title_center_px": [540, 255],
    "content_center_px": [540, 555],
    "mascot_center_px": [375, 1210],
    "mascot_right_center_px": [710, 1210],
    "aside_center_px": [820, 1130],
    "aside_right_center_px": [265, 1130],
    "cta_center_px": [540, 1465],
    "footer_box": [75, 1765, 930, 64],
    "progress_box": [90, 1850, 990, 1860]
  },
  "motion": {
    "seed": 90,
    "mascot_bob_px": 7,
    "mascot_bob_rate": 3.0
  },
  "audio": {
    "bgm_default": "off",
    "sfx_gain": 1.0
  }
}
